13:56:48.753845 IP vm1849213.stark-industries.solutions.http > srv60.niagahoster.com.44864: Flags [S.], seq 2277558401, ack 957096187, win 65160, options [mss 1460,sackOK,TS val 1276341683 ecr 1138321571,nop,wscale 7], length 0
13:56:48.753863 IP vm1849213.stark-industries.solutions.http > srv69.niagahoster.com.54590: Flags [S.], seq 564471464, ack 1615287915, win 65160, options [mss 1460,sackOK,TS val 3860861693 ecr 2044291235,nop,wscale 7], length 0
13:56:49.265857 IP vm1849213.stark-industries.solutions.http > srv69.niagahoster.com.54060: Flags [S.], seq 2867700892, ack 1404905668, win 65160, options [mss 1460,sackOK,TS val 3860862205 ecr 1222207651,nop,wscale 7], length 0
13:56:49.265882 IP vm1849213.stark-industries.solutions.http > srv69.niagahoster.com.62906: Flags [S.], seq 1400697153, ack 1152087724, win 65160, options [mss 1460,sackOK,TS val 3860862205 ecr 265906339,nop,wscale 7], length 0
13:56:49.329845 IP vm1849213.stark-industries.solutions.http > srv69.niagahoster.com.46490: Flags [S.], seq 1017012083, ack 3313014120, win 65160, options [mss 1460,sackOK,TS val 3860862269 ecr 433678499,nop,wscale 7], length 0
13:56:50.497531 IP vm1849213.stark-industries.solutions.http > srv60.niagahoster.com.57207: Flags [S.], seq 4112918889, ack 2296139974, win 65160, options [mss 1460,sackOK,TS val 1276343426 ecr 3772344483,nop,wscale 7], length 0
13:56:51.057901 IP vm1849213.stark-industries.solutions.http > srv69.niagahoster.com.32935: Flags [S.], seq 2062059459, ack 693583110, win 65160, options [mss 1460,sackOK,TS val 3860863997 ecr 282683555,nop,wscale 7], length 0
13:56:51.057923 IP vm1849213.stark-industries.solutions.http > srv69.niagahoster.com.39219: Flags [S.], seq 2464749504, ack 1874834882, win 65160, options [mss 1460,sackOK,TS val 3860863997 ecr 3856230563,nop,wscale 7], length 0
13:56:51.058943 IP vm1849213.stark-industries.solutions.http > srv69.niagahoster.com.54802: Flags [S.], seq 1835704933, ack 1328674142, win 65160, options [mss 1460,sackOK,TS val 3860863998 ecr 64579747,nop,wscale 7], length 0
13:56:51.313870 IP vm1849213.stark-industries.solutions.http > srv60.niagahoster.com.23944: Flags [S.], seq 144674071, ack 306105366, win 65160, options [mss 1460,sackOK,TS val 1276344243 ecr 4057557155,nop,wscale 7], length 0
13:56:51.505860 IP vm1849213.stark-industries.solutions.http > srv60.niagahoster.com.57207: Flags [S.], seq 4112918889, ack 2296139974, win 65160, options [mss 1460,sackOK,TS val 1276344435 ecr 3772344483,nop,wscale 7], length 0
13:56:51.894311 IP vm1849213.stark-industries.solutions.http > ns516771.ip-158-69-25.net.36732: Flags [F.], seq 1091122031, ack 2364129475, win 506, options [nop,nop,TS val 2509533032 ecr 620264072], length 0
13:56:52.081882 IP vm1849213.stark-industries.solutions.http > srv69.niagahoster.com.54802: Flags [S.], seq 1835704933, ack 1328674142, win 65160, options [mss 1460,sackOK,TS val 3860865021 ecr 64579747,nop,wscale 7], length 0
13:56:52.593856 IP vm1849213.stark-industries.solutions.http > srv69.niagahoster.com.21017: Flags [S.], seq 4090446233, ack 3973712090, win 65160, options [mss 1460,sackOK,TS val 3860865533 ecr 1306093731,nop,wscale 7], length 0
13:56:52.849898 IP vm1849213.stark-industries.solutions.http > srv60.niagahoster.com.17201: Flags [S.], seq 4003647205, ack 825123278, win 65160, options [mss 1460,sackOK,TS val 1276345779 ecr 1960405155,nop,wscale 7], length 0
13:56:52.849922 IP vm1849213.stark-industries.solutions.http > srv69.niagahoster.com.2132: Flags [S.], seq 2663752306, ack 3083236189, win 65160, options [mss 1460,sackOK,TS val 3860865789 ecr 4057557155,nop,wscale 7], length 0
13:56:53.361858 IP vm1849213.stark-industries.solutions.http > srv69.niagahoster.com.46490: Flags [S.], seq 1017012083, ack 3313014120, win 65160, options [mss 1460,sackOK,TS val 3860866301 ecr 433678499,nop,wscale 7], length 0
13:56:53.361875 IP vm1849213.stark-industries.solutions.http > srv69.niagahoster.com.62906: Flags [S.], seq 1400697153, ack 1152087724, win 65160, options [mss 1460,sackOK,TS val 3860866301 ecr 265906339,nop,wscale 7], length 0
13:56:53.521874 IP vm1849213.stark-industries.solutions.http > srv60.niagahoster.com.57207: Flags [S.], seq 4112918889, ack 2296139974, win 65160, options [mss 1460,sackOK,TS val 1276346451 ecr 3772344483,nop,wscale 7], length 0
13:56:53.666634 IP vm1849213.stark-industries.solutions.http > srv60.niagahoster.com.44864: Flags [S.], seq 2277558401, ack 957096187, win 65160, options [mss 1460,sackOK,TS val 1276346595 ecr 1138321571,nop,wscale 7], length 0
13:56:54.097848 IP vm1849213.stark-industries.solutions.http > srv69.niagahoster.com.54802: Flags [S.], seq 1835704933, ack 1328674142, win 65160, options [mss 1460,sackOK,TS val 3860867037 ecr 64579747,nop,wscale 7], length 0
13:56:54.166475 IP vm1849213.stark-industries.solutions.http > srv69.niagahoster.com.43691: Flags [S.], seq 862880815, ack 4005425592, win 65160, options [mss 1460,sackOK,TS val 3860867105 ecr 2077845667,nop,wscale 7], length 0
13:56:55.105251 IP vm1849213.stark-industries.solutions.http > srv69.niagahoster.com.48732: Flags [S.], seq 1800558047, ack 3320847206, win 65160, options [mss 1460,sackOK,TS val 3860868044 ecr 718891171,nop,wscale 7], length 0
13:56:55.186431 IP vm1849213.stark-industries.solutions.http > srv69.niagahoster.com.43691: Flags [S.], seq 862880815, ack 4005425592, win 65160, options [mss 1460,sackOK,TS val 3860868125 ecr 2077845667,nop,wscale 7], length 0
13:56:55.922512 IP vm1849213.stark-industries.solutions.http > srv69.niagahoster.com.59111: Flags [S.], seq 4023085093, ack 1785662297, win 65160, options [mss 1460,sackOK,TS val 3860868861 ecr 3990448291,nop,wscale 7], length 0
13:56:56.113852 IP vm1849213.stark-industries.solutions.http > srv69.niagahoster.com.48732: Flags [S.], seq 1800558047, ack 3320847206, win 65160, options [mss 1460,sackOK,TS val 3860869053 ecr 718891171,nop,wscale 7], length 0
13:56:56.178166 IP vm1849213.stark-industries.solutions.http > srv69.niagahoster.com.43691: Flags [S.], seq 862880815, ack 4005425592, win 65160, options [mss 1460,sackOK,TS val 3860869117 ecr 2077845667,nop,wscale 7], length 0
